<?xml version="1.0" encoding="UTF-8"?>
<tns:PolicyConfig xmlns:tns="http://www.bitwise.com/ComponentConfig" xmlns:xsi="http://www.w3.org/2001/XMLSchema-instance" xsi:schemaLocation="http://www.bitwise.com/ComponentConfig PolicyConfig.xsd ">
	<tns:masterpolicies>
		<tns:policy>
			<tns:name>ComponentEditPolicy</tns:name>
			<tns:value>com.bitwise.app.graph.policy.GraphComponentEditPolicy</tns:value>
		</tns:policy>
		<tns:policy>
			<tns:name>GraphicalNodeEditPolicy</tns:name>
			<tns:value>com.bitwise.app.graph.policy.ConnectionEditPolicy</tns:value>
		</tns:policy>
	</tns:masterpolicies>
</tns:PolicyConfig>
